{
  "$schema": "../schema.json",
  "name": "frieren",
  "description": "葬送のフリーレンに登場するフリーレン様のセリフ",
  "tags": ["anime", "japanese"],
  "mode": "replace",
  "verbs": [
    "…人間の寿命は短いってわかっていたのに… …なんでもっと知ろうと思わなかったんだろう…",
    "私の集めた魔法を褒めてくれた馬鹿がいた。それだけだよ。",
    "想いっていうのは言葉にしないと伝わらないのに。",
    "私は今の話をしているんだよ",
    "アウラ、自害しろ",
    "魔法は探し求めている時が一番楽しいんだよ",
    "また会ったときに恥ずかしいからね",
    "だって私……この人のこと何も知らないし……",
    "それは一朝一夕でどうにかなることじゃない。",
    "才能に関わらず、何年もかけていかなければいけないよ。",
    "おまえが死ぬまでにやるべきことは、あの子にしっかりと別れを告げて、なるべくたくさんの思い出を作ってやることだ。",
    "この魔法はね。ずっと昔に死んでしまった私の師匠が好きだった魔法なんだ。",
    "そうだね。",
    "勇者ヒンメルならそうしたってことだよ",
    "魔法はイメージの世界なんだ",
    "…縦ロールになっちゃった…",
    "正直興味はないよ。だから見て確かめるんだ。",
    "お前の前にいるのは1000年以上生きた魔法使いだ",
    "ふ〜ん面白くなってきた。ダンジョン攻略はこうでなくちゃ。",
    "暗いよ〜！怖いよ〜！",
    "私一人じゃこの日の出は見れなかったな",
    "おまえ達魔族は人の声まねをするだけの、言葉の通じない猛獣だ。",
    "相手が強かったら戦わないの？",
    "嫌なことは早めに終わらせないとね"
  ]
}
